{
  "$schema": "http://json-schema.org/draft-07/schema#",
  "title": "EvidenceCapsule",
  "type": "object",
  "additionalProperties": false,
  "required": ["artifact_kind", "run_id", "iteration_id", "base_ref", "inputs_hashes", "diff_summary", "checks", "touched_paths", "hash_manifest"],
  "properties": {
    "artifact_kind": {"const": "evidence_capsule"},
    "run_id": {"type": "string"},
    "iteration_id": {"type": "string"},
    "base_ref": {"type": "string"},
    "inputs_hashes": {"type": "object"},
    "diff_summary": {"type": "object"},
    "checks": {"type": "array"},
    "touched_paths": {"type": "array", "items": {"type": "string"}},
    "hash_manifest": {"type": "object"}
  }
}
